{
  "schema_version": 1,
  "project": {
    "slug": "example-paper-slug",
    "display_title": "Example Paper Title"
  },
  "research": {
    "topic": "Does method X improve metric Y on benchmark Z under constraint W?",
    "domain_hints": ["natural language processing", "interpretability"]
  },
  "constraints": {
    "target_venue": "neurips"
  },
  "execution_defaults": {
    "skip_online": false
  },
  "compute_defaults": {
    "seeds_per_condition": 5,
    "gpus_per_job": 1
  }
}
