{
  "schema_version": 1,
  "project": {
    "slug": "your-paper-slug",
    "display_title": "Your Paper Title"
  },
  "research": {
    "topic": "Write your research question here (1–3 sentences). Be concrete: method, metric, benchmark, and constraints.",
    "domain_hints": ["optional keyword", "optional adjacent field"]
  },
  "constraints": {
    "target_venue": "neurips"
  },
  "execution_defaults": {
    "skip_online": false
  },
  "compute_defaults": {
    "seeds_per_condition": 5,
    "gpus_per_job": 1
  }
}

